[
  {
    "slug": "solutions/connectivity",
    "title": "Connectivity",
    "description": "Carrier-grade network infrastructure \u2014 SD-WAN, MPLS, Wi-Fi 6E, fibre backbone and last-mile connectivity for enterprises across MEA.",
    "section": "Solutions",
    "source_url": "https://www.meaicon.com/solutions/connectivity",
    "competitors": [],
    "status": "pending",
    "priority": 8,
    "attempts": 0
  },
  {
    "slug": "solutions/sovereign-compute",
    "title": "Sovereign Compute",
    "description": "Sovereign cloud and on-premises compute infrastructure for governments and regulated industries in the MEA region.",
    "section": "Solutions",
    "competitors": [],
    "status": "pending",
    "priority": 7,
    "attempts": 0
  },
  {
    "slug": "industries/banking",
    "title": "Banking",
    "description": "Digital banking infrastructure \u2014 core modernisation, regulatory compliance, cybersecurity and real-time payments for MEA banks.",
    "section": "Industries",
    "competitors": [],
    "status": "pending",
    "priority": 6,
    "attempts": 0
  }
]